<?xml version="1.0" encoding="UTF-8"?>
<personComponents xmlns="http://www.sleepingdog.org.uk/oer-vector-library/person-components"
	xmlns:xsi="http://www.w3.org/2001/XMLSchema-instance"
	xsi:schemaLocation="http://www.sleepingdog.org.uk/oer-vector-library/person-components personComponents.xsd">
	<component id="person-1-front-arms-right-hand" designation="right">
		<twin id="person-1-front-arms-left-hand" symmetry="flip-horizontal" x="150" designation="left" />
	</component>
	<component id="person-1-front-arms-right-lower" designation="right">
		<twin id="person-1-front-arms-left-lower" symmetry="flip-horizontal" x="150" designation="left"/>
	</component>
	<component id="person-1-front-arms-right-upper" designation="right">
		<twin id="person-1-front-arms-left-upper" symmetry="flip-horizontal" x="150" designation="left"/>
	</component>
	<component id="person-1-front-legs-right-foot" designation="right">
		<twin id="person-1-front-legs-left-foot" symmetry="flip-horizontal" x="150" designation="left"/>
	</component>
	<component id="person-1-front-legs-right-lower" designation="right">
		<twin id="person-1-front-legs-left-lower" symmetry="flip-horizontal" x="150" designation="left"/>
	</component>
	<component id="person-1-front-legs-right-upper" designation="right">
		<twin id="person-1-front-legs-left-upper" symmetry="flip-horizontal" x="150" designation="left"/>
	</component>
	<component id="person-2-front-arms-right-hand" designation="right">
		<twin id="person-2-front-arms-left-hand" symmetry="flip-horizontal" x="150" designation="left" />
	</component>
	<component id="person-2-front-arms-right-lower" designation="right">
		<twin id="person-2-front-arms-left-lower" symmetry="flip-horizontal" x="150" designation="left"/>
	</component>
	<component id="person-2-front-arms-right-upper" designation="right">
		<twin id="person-2-front-arms-left-upper" symmetry="flip-horizontal" x="150" designation="left"/>
	</component>
	<component id="person-2-front-legs-right-foot" designation="right">
		<twin id="person-2-front-legs-left-foot" symmetry="flip-horizontal" x="150" designation="left"/>
	</component>
	<component id="person-2-front-legs-right-lower" designation="right">
		<twin id="person-2-front-legs-left-lower" symmetry="flip-horizontal" x="150" designation="left"/>
	</component>
	<component id="person-2-front-legs-right-upper" designation="right">
		<twin id="person-2-front-legs-left-upper" symmetry="flip-horizontal" x="150" designation="left"/>
	</component>
</personComponents>